{
    "$schema": "https://json-schema.org/draft-07/schema",
    "$id": "https://reconmap.com/reconmap-runner.schema.json",
    "title": "Reconmap runner configuration schema",
    "description": "Schema for the configuration of the Reconmap runner",
    "type": "object",
    "required": [
        "$schema",
        "keycloak",
        "reconmapApi",
        "redis",
        "validOrigins",
        "runnerDirectory"
    ],
    "properties": {
        "$schema": {
            "type": "string",
            "format": "string-uri"
        },
        "keycloak": {
            "type": "object",
            "required": [
                "baseUri",
                "clientId",
                "clientSecret"
            ],
            "properties": {
                "baseUri": {
                    "type": "string",
                    "format": "uri"
                },
                "clientId": {
                    "type": "string"
                },
                "clientSecret": {
                    "type": "string"
                }
            },
            "additionalProperties": false
        },
        "reconmapApi": {
            "type": "object",
            "required": [
                "baseUri"
            ],
            "properties": {
                "baseUri": {
                    "type": "string",
                    "format": "uri"
                }
            },
            "additionalProperties": false
        },
        "redis": {
            "type": "object",
            "required": [
                "host",
                "port",
                "username",
                "password"
            ],
            "properties": {
                "host": {
                    "type": "string"
                },
                "port": {
                    "type": "integer",
                    "minimum": 1,
                    "maximum": 65535
                },
                "username": {
                    "type": "string"
                },
                "password": {
                    "type": "string"
                }
            },
            "additionalProperties": false
        },
        "validOrigins": {
            "type": "string",
            "description": "Exact dashboard origin permitted to open terminal WebSockets, including scheme and optional port, without a path."
        },
        "runnerDirectory": {
            "type": "string"
        }
    },
    "additionalProperties": false
}
