{
    "$schema": "https://raw.githubusercontent.com/reconmap/reconmap/refs/heads/main/src/runner/config-schema.json",
    "keycloak": {
        "baseUri": "http://keycloak:8080",
        "clientId": "",
        "clientSecret": ""
    },
    "reconmapApi": {
        "baseUri": "http://api:5510"
    },
    "redis": {
        "host": "redis",
        "port": 6379,
        "username": "default",
        "password": "REconDIS"
    },
    "validOrigins": "http://localhost:5500",
    "runnerDirectory": "/tmp"
}